{
  "schema_version": "1.0",
  "id": "20000000-0000-4000-8000-000000000004",
  "tenant_id": "10000000-0000-4000-8000-000000000001",
  "channel_connection_id": "20000000-0000-4000-8000-000000000001",
  "external_conversation_id": "thread-synthetic-001",
  "lifecycle_status": "new",
  "adapter_metadata": {
    "thread_kind": "direct"
  },
  "created_at": "2026-07-12T08:00:00.000Z",
  "updated_at": "2026-07-12T08:30:00.000Z"
}
